"School shooting reported in Saskatchewan, Canada: CBC "                                                                                      ,TNWSS
China taking 'self-isolating' steps in South China Sea: Pentagon:                                                                             ,TNWSS
Kofi Annan shares his thoughts on the possibility of a Donald Trump presidency with Stephen Jadler                                            ,TNWSS
Haiti election postponed over security concerns: AFP                                                                                          ,TNWSS
U.S. 'hopes' Saudi Arabia may reopen Tehran embassy                                                                                           ,TNWSS
Spain's Rajoy declines to seek confidence of parliament                                                                                       ,TNWSS
IMF's Lagarde seeks second term as managing director of the International Monetary Fund:                                                      ,TNWSS
Kerry says effort and good faith could lead to lifting of sanctions on Russia:                                                                ,TNWSS
U.S. military urges 'decisive action' against Islamic State in Libya                                                                          ,TNWSS
Freed Washington Post journalist Rezaian headed to U.S. -                                                                                     ,TNWSS
Sarkozy draws presidential election spotlight with book                                                                                       ,TNWSS
Saudi-backed Syrian opposition rules out talks before end to Russian air raids:                                                               ,TNWSS
Pentagon chief says Turkey could do more in fight against IS                                                                                  ,TNWSS
"U.S. military says two more civilians killed, four hurt in air strikes "                                                                     ,TNWSS
Argentina's Macri hopes for creditor deal early in 2016:                                                                                      ,TNWSS
North Korea detains U.S. student on New Year trip for 'hostile act':                                                                          ,TNWSS
"Czech MEP, arrested in Swiss bank case, dies in Prague "                                                                                     ,TNWSS
"Hungary's Orban urges fence between Greece and Macedonia, Bulgaria "                                                                         ,TNWSS
Carter - U.S-led coalition needs to take back Mosul and Raqqa:                                                                                ,TNWSS
Greek farmers rail against Tsipras as taxes loom                                                                                              ,TNWSS
Rival camps bicker over teams for Syria peace talks:                                                                                          ,TNWSS
"In Spain, left-wing coalition gains ground as king ends talks:  "                                                                            ,TNWSS
Syrian opposition rules out indirect talks before goodwill steps:                                                                             ,TNWSS
Belgian court orders release of Paris attacks suspect                                                                                         ,TNWSS
Mexico speeding efforts to ensure 'Chapo' extradited: president                                                                               ,TNWSS
Syria opposition rules out talks before end to air raids                                                                                      ,TNWSS
Russia voices anger at U.S. treatment of honorary consuls                                                                                     ,TNWSS
Freed Washington Post journalist Rezaian headed to U.S.: statement                                                                            ,TNWSS
U.S. Vice President Biden chides Turkey over freedom of expression                                                                            ,TNWSS
Freed Washington Post journalist Jason Rezaian headed home to the U.S. - statement                                                            ,TNWSS
Poland clouds NATO's nuanced Russia plan                                                                                                      ,TNWSS
Kerry says effort and good faith could lead to Russian sanctions lifting                                                                      ,TNWSS
U.S. wants U.N. to raise refugee aid by a third to $13 billion:                                                                               ,TNWSS
At least 42 migrants drown as boats capsize off Greek islands                                                                                 ,TNWSS
U.S.-led coalition needs to take back Mosul and Raqqa: Carter                                                                                 ,TNWSS
Kremlin rejects media report Putin envoy asked Syria's Assad to step down - Tass:                                                             ,TNWSS
"At least 42 migrants, including 17 children, drowned when their boat capsized off a Greek island: Coastguard"                                ,TNWSS
"With just days to go, rival camps bicker over who should be invited to Syria peace talks:  "                                                 ,TNWSS
Mauricio Macri is the first Argentine president to join Davos in more than a decade.                                                          ,TNWSS
"Five years on, unrest is testing the 'Arab Spring' model country Tunisia:  "                                                                 ,TNWSS
Islamic State claims responsibility for Cairo attack that killed nine                                                                         ,TNWSS
"Islamist gunmen set off bombs and stormed a Somali beach restaurant, killing 17:  "                                                          ,TNWSS
Israeli MPs oppose eviction of Jewish settlers from West Bank homes                                                                           ,TNWSS
Wife of U.S. pastor freed after years of Iran imprisonment hopes to rebuild their marriage:                                                   ,TNWSS
"Texts, Internet, social networks are 'gift of God' if used wisely: Pope Francis "                                                            ,TNWSS
"Five years on, unrest tests 'Arab Spring' model Tunisia "                                                                                    ,TNWSS
U.S. steps up talks on making Hawaii missile test site operational - sources.                                                                 ,TNWSS
John Kerry: People don't fly to Davos to celebrate the status quo. None of you are here for that.                                             ,TNWSS
The deadly Islamist attack at a Somali beachside restaurant.                                                                                  ,TNWSS
China jails rights activist on spying charges as crackdown widens                                                                             ,TNWSS
"Poland is to permanently host 1,000 British troops from 2017:  "                                                                             ,TNWSS
"In Spain, left-wing coalition seen more likely as king ends talks "                                                                          ,TNWSS
"India, France haggle over $9-billion warplane deal in run-up to Hollande visit "                                                             ,TNWSS
At least eight migrants including two children drown in sinking off Greek island:                                                             ,TNWSS
Senior Pakistani Taliban commander vows more school attacks in                                                                                ,TNWSS
Gunmen seize weapons in armory raid in Burkina Faso                                                                                           ,TNWSS
Russia to strengthen military in response to NATO expanding drills: agencies                                                                  ,TNWSS
U.N. diplomats urge Burundi dialogue as rebels raise stakes                                                                                   ,TNWSS
South Korea's Park seeks 5-party talks on North's nuclear program                                                                             ,TNWSS
"Don't read too much into military drills, China says after Taiwan alarm  "                                                                   ,TNWSS
Aviation giants tread carefully in test case for post-sanctions Iran                                                                          ,TNWSS
Five children hurt in school attack in southeast Turkey blamed on PKK                                                                         ,TNWSS
"Laos PM, party boss set for political exit after congress vote "                                                                             ,TNWSS
Pakistan Taliban commander vows more school attacks in video                                                                                  ,TNWSS
Iraq to start Mosul offensive against IS in first half of 2016: Minister                                                                      ,TNWSS
French PM says refugee crisis threatening idea of EU: BBC                                                                                     ,TNWSS
World Islamic body backs Saudi stance in Iran spat                                                                                            ,TNWSS
Japan lifts nuclear sanctions on Iran                                                                                                         ,TNWSS
At least eight migrants drown in sinking off Greek island                                                                                     ,TNWSS
Twelve Marines declared dead after helicopter crash off Hawaii                                                                                ,TNWSS
North Korea says detains U.S. student for 'hostile act'                                                                                       ,TNWSS
Islamist gunmen kill 17 in Somalia beach restaurant attack                                                                                    ,TNWSS
U.S. Navy's Fort Worth LCS ship suffers gear damage in Singapore                                                                              ,TNWSS
"Murder rate climbs in Mexico, while other crimes fall  "                                                                                     ,TNWSS
Modi may bet on old faces and new to regain winning ways                                                                                      ,TNWSS
Myanmar to release political prisoners before power transfer                                                                                  ,TNWSS
Militant attacks in Asia inject new urgency into U.S. bomb training                                                                           ,TNWSS
"Wife of U.S. pastor imprisoned in Iran hopes to reunite, rebuild marriage  "                                                                 ,TNWSS
"Obama, Merkel discuss aid for Syrian refugees: White House "                                                                                 ,TNWSS
U.N. draft calls for 12-month mission to verify Colombia peace deal                                                                           ,TNWSS
"Vice President Biden, Iraq's Abadi discuss Turkish troop issue: White House "                                                                ,TNWSS
U.S. tightens visa waiver rules for visitors after Paris attacks                                                                              ,TNWSS
"Fearing genocide, ex-Burundi presidents plead for U.N. troops "                                                                              ,TNWSS
Former U.S. Marine held in Iran arrives home                                                                                                  ,TNWSS
Obama promises Merkel to 'substantially' support refugee efforts: Berlin                                                                      ,TNWSS
Iran-linked groups focus of Baghdad kidnapping probe: U.S. sources:                                                                           ,TNWSS
Three migrants die in Lesbos from hypothermia after icy sea crossing                                                                          ,TNWSS
"With days to go, rival camps bicker over teams for Syria peace talks "                                                                       ,TNWSS
U.S. gives troops broader order to strike Islamic State in Afghanistan                                                                        ,TNWSS
Brussels urges more migration within EU as Britain resists                                                                                    ,TNWSS
Yemen oil port fire from Saudi-led air strike kills at least nine                                                                             ,TNWSS
"Islamists bomb, storm restaurant in Somali capital "                                                                                         ,TNWSS
"U.N. agency eyes 50,000 Somalis returning from Kenyan camp "                                                                                 ,TNWSS
Kerry believes 2016 will see Islamic State 'seriously dented'                                                                                 ,TNWSS
Three people killed in Cairo blast                                                                                                            ,TNWSS
Pope tells Davos elite: Consider your role in creating poverty:                                                                               ,TNWSS
Israel demolishes EU structures and says it will seize West Bank land:                                                                        ,TNWSS
Thousands of people are protesting in Moldova after new PM is hastily sworn in at midnight:                                                   ,TNWSS
Denmark considers moving migrants to camps outside cities:                                                                                    ,TNWSS
Sudanese refugee who walked through Channel Tunnel will face UK trial:                                                                        ,TNWSS
Pakistan attack raises tough question: should teachers shoot back?                                                                            ,TNWSS
Iraqi PM doubts any Iranian link with three missing Americans:                                                                                ,TNWSS
French PM says Brexit would be tragedy:                                                                                                       ,TNWSS
"Some 200,000 at risk in Turkey's fight against Kurdish militants: Amnesty -  "                                                               ,TNWSS
"With symbolic handshake at Davos, Cyprus leaders ask elite to back peace:"                                                                   ,TNWSS
Saudi-Iran dispute jeopardizes Yemen peace talks                                                                                              ,TNWSS
Gang warfare in El Salvador pushes death rate to record                                                                                       ,TNWSS
World chess champion Garry Kasparov forecasts bloody regime change in Russia.                                                                 ,TNWSS
"From Dakar to N'Djamena, hotels boost security after Burkina attack "                                                                        ,TNWSS
Iraq prime minister doubts any Iranian link to three missing Americans                                                                        ,TNWSS
Dreadlocks and poets herald new face of Spanish parliament:                                                                                   ,TNWSS
UK inquiry says Russia's Putin 'probably' approved London murder of ex-KGB agent Litvinenko:                                                  ,TNWSS
"Wall Street weighs into Britain's EU referendum: Goldman, JPMorgan back 'in' campaign "                                                      ,TNWSS
Taliban warns TV station staff not to promote immorality after attack                                                                         ,TNWSS
Ukraine investigates Coca-Cola and Pepsico over Crimea map row: MP                                                                            ,TNWSS
Turkish PM says no role for 'terrorist groups' in Syria talks                                                                                 ,TNWSS
"Europe has two months to address refugee crisis, EU at risk: Swedish PM "                                                                    ,TNWSS
"Arab, Kurdish forces to get more support to fight Islamic State: Hollande "                                                                  ,TNWSS
U.S. leads 16 strikes against Islamic State: statement                                                                                        ,TNWSS
Israel confirms it plans to seize a large tract of West Bank land:                                                                            ,TNWSS
Ecuador asks Sweden to submit new application over questioning of Wikileaks founder Assange:                                                  ,TNWSS
Seehofer says Germany must control its borders if EU can't                                                                                    ,TNWSS
Kerry says there will be no 'fundamental delay' in Syria talks                                                                                ,TNWSS
On the U.S. end of the Iran prisoner deal there were final-hour doubts and delays:                                                            ,TNWSS
"UPDATE: UK Interior Minister says Interpol notices, European arrest warrants in place for two main suspects of Litvinenko murder"            ,TNWSS
UPDATE: UK Interior Minister May says deeply disturbing that Russian state probably involved in Litvinenko murder.                            ,TNWSS
A 'DiCaprio' ultimatum for energy bossses?                                                                                                    ,TNWSS
"French PM says Brexit would be tragedy, hopes for progress in February "                                                                     ,TNWSS
Does the idea of President Trump scare you? We asked around at WEF16. Live coverage here:                                                     ,TNWSS
Belgium detains two suspects in Paris attacks probe:                                                                                          ,TNWSS
Litvinenko murder suspect Lugovoy calls UK inquiry accusations 'absurd':                                                                      ,TNWSS
Israel confirms it plans to seize West Bank land                                                                                              ,TNWSS
Dutch PM says Europe has 6-8 weeks to get grip on refugee crisis                                                                              ,TNWSS
Putin probably approved London murder of ex-KGB agent Alexander Litvinenko: British inquiry.                                                  ,TNWSS
Putin probably approved London murder of Litvinenko: British inquiry                                                                          ,TNWSS
"Chinese flood Taiwan president-elect's Facebook, demanding return to China  "                                                                ,TNWSS
Vladimir Putin probably approved operation to kill ex-KGB agent Alexander Litvinenko in London in 2006 – UK inquiry                           ,TNWSS
Filipinos plan second protest trip to islands disputed with China                                                                             ,TNWSS
JPMorgan to make donation to UK's pro-EU campaign: Sky                                                                                        ,TNWSS
Haiti in talks to delay Sunday presidential runoff after protests                                                                             ,TNWSS
U.S. offers Turkey technology to block Islamic State at Syria border                                                                          ,TNWSS
Thai authorities arrest four activists over attempted protest                                                                                 ,TNWSS
"On U.S. end of Iran prisoner deal, doubts and delays in final hours "                                                                        ,TNWSS
Militants attack near Libya's Ras Lanuf oil terminal: sources                                                                                 ,TNWSS
Tokyo goes for broke in Okinawa poll at U.S. airbase city                                                                                     ,TNWSS
China military reports landing drills days after Taiwan election                                                                              ,TNWSS
China's Xi offers support to Egypt ahead of uprising anniversary                                                                              ,TNWSS
"Mexico, Central American countries OK plan for stranded Cubans  "                                                                            ,TNWSS
U.N. council votes to reduce Ivory Coast peacekeepers                                                                                         ,TNWSS
Vatican says British exit from EU would weaken Europe: media report                                                                           ,TNWSS
Britain drafting U.N. resolution to set up Colombia mission: envoys                                                                           ,TNWSS
Hague prosecutors seek trial of Lord's Resistance Army ex-commander                                                                           ,TNWSS
"China busts child trafficking ring, recovers 15 infants: Xinhua "                                                                            ,TNWSS
Source says 'Affluenza' teen to drop fight against Mexico deportation:                                                                        ,TNWSS
France acts to secure road above Calais refugee 'jungle'                                                                                      ,TNWSS
Reform uncertainty in Vietnam after PM left off leadership nominations                                                                        ,TNWSS
Bankers say end of loose monetary policy era has fueled volatility:                                                                           ,TNWSS
Brazil President called as witness in bribery investigation                                                                                   ,TNWSS
VIDEO. The Exchange: Garry Kasparov forecasts bloody regime change in Russia. Watch -                                                         ,TNWSS
"Syria talks may not start on Jan. 25, 'pressure, momentum' needed: U.N. envoy "                                                              ,TNWSS
Ecuador says Assange will answer Sweden's questions in days                                                                                   ,TNWSS
Ukraine plans new diplomatic push to recover Crimea: Finance Minister                                                                         ,TNWSS
"U.S. senator was told of link between Iran sanctions, prisoners "                                                                            ,TNWSS
"Finland, Norway bridle at migrant flows from Russia "                                                                                        ,TNWSS
Recent strike targets Mosul 'cash collection point': U.S. military                                                                            ,TNWSS
"Suicide bomb in Afghan capital targets journalists, killing seven people:  "                                                                 ,TNWSS
Families return to Damascus suburb under local ceasefire: monitor                                                                             ,TNWSS
"In a reversal, Cuba tries price controls to tame food inflation "                                                                            ,TNWSS
Magnitude 6.1 earthquake jolts central China                                                                                                  ,TNWSS
"As Venezuela's economy sinks, smuggling soars to unprecedented levels:  "                                                                    ,TNWSS
"Ten wounded, including opposition politicians, in southeast Turkey shooting "                                                                ,TNWSS
"Militants storm Pakistan university, killing at least 20:  "                                                                                 ,TNWSS
"Unlikely outsider Juppé is threat to Sarkozy, Hollande's 2017 election bids "                                                                ,TNWSS
