Fate of Florida death row inmates in limbo after U.S. Supreme Court ruling                                                                    ,TNWSS
Blasts in Indonesian capital; at least six dead -                                                                                             ,TNWSS
Winning $1.6 billion Powerball tickets sold in three states: lottery officials                                                                ,TNWSS
Asian shares skid as Brent crude plumbs 12-year lows                                                                                          ,TNWSS
California lottery says it has a Powerball winner                                                                                             ,TNWSS
"Accused Colorado clinic shooter intends to plead guilty, expects execution: report "                                                         ,TNWSS
Obama to offer in budget to extend deadline for Medicaid expansion                                                                            ,TNWSS
California lottery says it has a winner in $1.6 billion Powerball jackpot                                                                     ,TNWSS
"GE moving headquarters to Boston for tech talent, tax cut  "                                                                                 ,TNWSS
"Blasts, gunfight in Indonesian capital; at least three dead "                                                                                ,TNWSS
U.S. shares tumble; Brent crude slips below $30                                                                                               ,TNWSS
Hollywood's Sean Penn lied about 'Chapo' trafficking claim: lawyer                                                                            ,TNWSS
Iran frees U.S. sailors with start of nuclear deal in sight                                                                                   ,TNWSS
"South Korea, China defense officials to discuss North Korea test: Yonhap "                                                                   ,TNWSS
Bid to mine more coal on U.S. federal lands tests Obama's green agenda                                                                        ,TNWSS
Legionnaires' spike in Michigan county dealing with water crisis:                                                                             ,TNWSS
"In 'red state' tour, Obama talks with worried Nebraska mom "                                                                                 ,TNWSS
"U.S. targets money laundering in all-cash home sales in Miami, Manhattan "                                                                   ,TNWSS
"Donald Trump was not in the room during the SOTU, but he was a looming presence:  "                                                          ,TNWSS
Steven Avery of Making a Murderer case wants out on bond:                                                                                     ,TNWSS
Judge leaning toward sealing some evidence in the Cosby sex suit:                                                                             ,TNWSS
The St. Louis Rams are headed to Los Angeles:                                                                                                 ,TNWSS
GE to move headquarters to Boston from Connecticut                                                                                            ,TNWSS
Powerball mania takes over Twitter:                                                                                                           ,TNWSS
Iran frees U.S. sailors swiftly as diplomacy smoothes waters:                                                                                 ,TNWSS
Istanbul suicide bomber entered Turkey as a migrant: Turkish PM                                                                               ,TNWSS
Four people detained in connection with Istanbul bombing: Turkish PM                                                                          ,TNWSS
China arrests its most prominent woman rights lawyer for subversion:                                                                          ,TNWSS
El Chapo lawyer says Sean Penn should testify about his Rolling Stone article.                                                                ,TNWSS
Kerry thanks Iran for cooperation in release of 10 Navy sailors.                                                                              ,TNWSS
Kim Davis attends President Obama's final State of the Union address.                                                                         ,TNWSS
Anti-immigrant 'Soldiers of Odin' raise concern in Finland                                                                                    ,TNWSS
Iran releases 10 U.S. sailors after holding them overnight.                                                                                   ,TNWSS
Stock futures rise on China trade data surprise:                                                                                              ,TNWSS
"Powerball hits $1.5 billion, largest-ever lottery jackpot for one winner -  "                                                                ,TNWSS
Europe turns to Morocco in Paris attacks investigation                                                                                        ,TNWSS
Suicide bomber kills at least 15 outside Pakistan polio centre:                                                                               ,TNWSS
Iran releases U.S. sailors after brief detention:                                                                                             ,TNWSS
German foreign ministry spokeswoman says ten Germans were killed in Istanbul suicide bombing                                                  ,TNWSS
Iran released U.S. sailors in international waters:                                                                                           ,TNWSS
Pride in North Korea nuclear tests eroded by daily grind                                                                                      ,TNWSS
FIFA fires Secretary General Valcke:                                                                                                          ,TNWSS
Iran's Revolutionary Guard says has released detained U.S. sailors - report                                                                   ,TNWSS
Moscow confirms Russians detained in Turkey over Islamic State links: RIA                                                                     ,TNWSS
Iran's Guards say U.S. sailors will probably be released: Tasnim                                                                              ,TNWSS
Belgium identifies three Paris attack plot safe houses                                                                                        ,TNWSS
Turkey detains three Russians suspected of Islamic State ties after Istanbul bomb: media                                                      ,TNWSS
"China Dec. exports, imports fall much less than expected after yuan slides  "                                                                ,TNWSS
Oil's slide below $30 sends shockwaves far and wide                                                                                           ,TNWSS
"Iran's Revolutionary Guards question U.S. sailors, dismiss talk of prompt release  "                                                         ,TNWSS
South Korea fires warning shots at suspected drone near border: media                                                                         ,TNWSS
"Suspected suicide blast kills at least 14, injures 20 near Pakistan polio center "                                                           ,TNWSS
Reports of U.S. sailors' prompt release is speculation: Iran's Revolutionary Guards                                                           ,TNWSS
Iran holds 10 American sailors; U.S. expects their prompt return                                                                              ,TNWSS
Crude oil rises for first time in eight days after U.S. stocks fall                                                                           ,TNWSS
Asia stocks cheered by China trade surprise                                                                                                   ,TNWSS
St. Louis Rams green-lit for move to Los Angeles                                                                                              ,TNWSS
South Carolina Gov. Nikki Haley's SOTU response was praised by both sides of politics.                                                        ,TNWSS
"Obama knocks Republicans for anti-Muslim rhetoric, seeks to set 2016 tone "                                                                  ,TNWSS
"Suicide bomber kills 10 people, mainly Germans, in Istanbul  "                                                                               ,TNWSS
President Obama's final State of the Union address                                                                                            ,TNWSS
Paul Ryan was the focus of many social media jeers during Obama's SOTU speech over a perceived lack of applause.                              ,TNWSS
U.S. House backs broader N.Korea sanctions; South Korea calls on China                                                                        ,TNWSS
Obama deviated from his prepared SOTU text to insert a reference to the herion epidemic.                                                      ,TNWSS
St. Louis Rams approved for relocation to Los Angeles                                                                                         ,TNWSS
Watch President Obama's last State of the Union address at Reuters Live                                                                       ,TNWSS
The First Lady has entered the chamber. Keep up with the latest SOTU developments here:                                                       ,TNWSS
"As relations thaw, some Iranian prisoners in U.S. hope for early release:  "                                                                 ,TNWSS
"  NFL owners approve St. Louis Rams relocation to L.A., give San Diego Chargers option to join them."                                        ,TNWSS
"Fearing third escape, prison guards watch Mexico drug boss Chapo 24/7 "                                                                      ,TNWSS
Majority of Americans support next president pushing tighter gun laws                                                                         ,TNWSS
Iran holds 10 U.S. sailors; White House expects prompt return                                                                                 ,TNWSS
U.N. war crimes investigators gathering testimony from starving Syrian town                                                                   ,TNWSS
Iran says it will return U.S. Navy sailors early Wednesday morning Gulf time: U.S. official                                                   ,TNWSS
"House of Representatives backs broader North Korea sanctions, after nuclear test "                                                           ,TNWSS
U.S. House of Representatives approves legislation to broaden sanctions against North Korea                                                   ,TNWSS
Pentagon says two Navy boats in Iranian custody                                                                                               ,TNWSS
NFL panel recommends Carson for proposed L.A. stadium:                                                                                        ,TNWSS
White House seeking the return of Navy personnel in Iranian custody:                                                                          ,TNWSS
MORE: Iran has two U.S. Navy boats in custody and has told the U.S. the crew will be returned promptly: U.S. official                         ,TNWSS
Looking ahead at Obama's final SOTU:                                                                                                          ,TNWSS
" White House says is working to resolve situation with Navy boats in Iranian custody, wants personnel returned to normal deployment"         ,TNWSS
NFL panel recommends Carson over Inglewood for proposed L.A. stadium                                                                          ,TNWSS
New York jury hears claim GM concealed ignition switch defect                                                                                 ,TNWSS
"NFL committee appears to favor Carson plan backed by San Diego Chargers, Oakland Raiders over St. Louis Rams plan."                          ,TNWSS
NFL poised for L.A. move after 20 years of hard bargaining with cities.                                                                       ,TNWSS
Obama voices regret for failing to unite Washington as he prepares for State of the Union:                                                    ,TNWSS
Rupert Murdoch's engagement to Jerry Hall sparks plenty of social media snark:                                                                ,TNWSS
Supreme Court strikes down Florida death sentence process                                                                                     ,TNWSS
The Powerball jackpot is the largest-ever U.S. lottery prize at $1.5 billion:                                                                 ,TNWSS
Republican Rubio authors Senate bill to curb Cuban immigration benefits                                                                       ,TNWSS
The 'heartbreaking scenes' aid workers witnessed in the starving Syrian town of Madaya:                                                       ,TNWSS
John Edwards among lawyers vying for lead role in Volkswagen suit:                                                                            ,TNWSS
Oil slump nears $30 a barrel mark on unabated output                                                                                          ,TNWSS
Fears of illiberal Central Europe axis may be overblown                                                                                       ,TNWSS
Media mogul Rupert Murdoch and former supermodel Jerry Hall plan to tie the knot:                                                             ,TNWSS
The last of five teens accused of raping woman in Brooklyn playground taken into custody:                                                     ,TNWSS
"A look at the day around the world, in   "                                                                                                   ,TNWSS
Mexican kingpin 'Chapo' tried to trademark his name -local TV                                                                                 ,TNWSS
Most victims of Istanbul suicide attack were German tourists:                                                                                 ,TNWSS
"Four teens charged in New York gang rape, fifth is sought "                                                                                  ,TNWSS
" Powerball payout hits $1.5 billion, world's largest ever for a single winner"                                                               ,TNWSS
Cook County Jail in Chicago on lockdown after 18 percent of guard shift absent: local media                                                   ,TNWSS
Did North Korea fake its sub-launched missile test?                                                                                           ,TNWSS
Rupert Murdoch announces his engagement to former supermodel Jerry Hall:                                                                      ,TNWSS
Images from the scene after a suicide blast kills at least 10 people.                                                                         ,TNWSS
'Affluenza' mom expected to be released from jail:                                                                                            ,TNWSS
Turkey's prime minister says suspected bomber is a foreign member of Islamic State.                                                           ,TNWSS
"Shares, oil recover as Europe shrugs off China money market surge "                                                                          ,TNWSS
Billionaire Lasry's fund not reporting asset levels:                                                                                          ,TNWSS
"Israeli soldiers kill two Palestinians, one an alleged stabber "                                                                             ,TNWSS
Erdogan says Syrian suicide bomber thought to be responsible for Istanbul attack:                                                             ,TNWSS
Mother of Texas 'affluenza' teen expected to be released from jail                                                                            ,TNWSS
"Biden says he's not surprised Sanders ties Clinton in Iowa, NH, polls "                                                                      ,TNWSS
Most of those killed in Istanbul blast were German citizens - Turkish officials                                                               ,TNWSS
"Sanctions impact on Russia to be longer term, U.S. says "                                                                                    ,TNWSS
"At least 51 killed in attacks in Iraqi capital, eastern town "                                                                               ,TNWSS
Oil steadies below $32 as investors book profits:                                                                                             ,TNWSS
Blast in Istanbul tourist district kills at least 10 people:                                                                                  ,TNWSS
Turkey's Erdogan says Syrian suicide bomber believed responsible for blast in Istanbul square                                                 ,TNWSS
Icahn buying up Time Warner shares: sources -                                                                                                 ,TNWSS
"Ten dead, fifteen wounded in Istanbul blast: governor's office:  "                                                                           ,TNWSS
"Mobile clinics, medical teams needed in Madaya: WHO official tell Reuters "                                                                  ,TNWSS
North Korea faked sub-launched missile test footage: analysis -                                                                               ,TNWSS
"Rupert Murdoch, Jerry Hall announce engagement:  "                                                                                           ,TNWSS
"Several dead, wounded after blast in central Istanbul: Turkish TV -  "                                                                       ,TNWSS
" Istanbul governor's office says 10 killed, 15 wounded in Sultanahmet explosion"                                                             ,TNWSS
Turkish police seal off historic Istanbul square after blast:                                                                                 ,TNWSS
Wanda goes to Hollywood: China tycoon's firm buys film studio Legendary for $3.5 billion                                                      ,TNWSS
"Several dead, wounded after blast in central Istanbul: Turkish TVs "                                                                         ,TNWSS
" Several dead, wounded after blast in Istanbul - Turkish TV"                                                                                 ,TNWSS
Oil prices tumble 3 percent to just over $30; traders bet on more falls                                                                       ,TNWSS
"Obama's last State of the Union to set final goals, promote legacy  "                                                                        ,TNWSS
Mexico says Sean Penn meeting was 'essential' to finding kingpin Chapo                                                                        ,TNWSS
"Mother of Texas 'affluenza' teen posts bond, set for Tuesday release "                                                                       ,TNWSS
"China seeks to stabilize yuan, stocks still fragile  "                                                                                       ,TNWSS
"Asia stocks wary as China concerns remain, oil drops  "                                                                                      ,TNWSS
Judge authorizes search after scent of slain Virginia woman is found                                                                          ,TNWSS
Billionaire Lasry's junk fund stops reporting asset levels amid turmoil                                                                       ,TNWSS
Seven candidates qualify for Thursday's main presidential debate                                                                              ,TNWSS
Muslim woman's silent Trump protest was far from spontaneous                                                                                  ,TNWSS
China's Dalian Wanda buys control of Legendary Entertainment in $3.5 billion deal                                                             ,TNWSS
Clinton seeks surcharge tax on wealthiest tier of Americans                                                                                   ,TNWSS
Seven candidates qualify for Thursday's main U.S. presidential debate                                                                         ,TNWSS
Central American immigrants scramble for options to deportation by U.S.                                                                       ,TNWSS
Aid convoy reaches starving Syrian town of Madaya                                                                                             ,TNWSS
About 15 state attorneys general join probe of health insurer mergers.                                                                        ,TNWSS
A timeline of GM's faulty ignition switch:                                                                                                    ,TNWSS
"Judge lowers bond for 'affluenza' mom from $1 million to $75,000:  "                                                                         ,TNWSS
"A look at the last 24 hours around the world, in   "                                                                                         ,TNWSS
Obama to make good on Guantanamo pledge: White House chief of staff                                                                           ,TNWSS
What are the Powerball odds? A  $2 ticket has a one in 292.2 million chance of winning:                                                       ,TNWSS
U.S. stocks finish higher in late rally after sliding as much as 1 percent                                                                    ,TNWSS
"Scent of Virginia student found in apartment of man charged with murdering her, witness says  "                                              ,TNWSS
Slain Virginia student's scent found in suspect's apartment: witness                                                                          ,TNWSS
U.S. Powerball fever grips ticket buyers with prize at $1.4 billion                                                                           ,TNWSS
A timeline of GM's faulty ignition switch saga:                                                                                               ,TNWSS
A look at the elaborate outfits that shaped David Bowie's pop personas.                                                                       ,TNWSS
George Washington University rescinds Cosby's doctorate                                                                                       ,TNWSS
NYPD searching for the last of five suspects in Brooklyn playground rape:                                                                     ,TNWSS
North Korea holding U.S. citizen for allegedly spying for South Korea: CNN                                                                    ,TNWSS
What we know about the hours leading up to 'El Chapo's' capture:                                                                              ,TNWSS
"At least 48 killed in attacks in Iraqi capital, eastern town "                                                                               ,TNWSS
Oscar Pistorius files papers to appeal conviction for the murder of his girlfriend:                                                           ,TNWSS
How North Korea developed a nuclear weapons program despite poverty and sanctions:                                                            ,TNWSS
Watchdog report finds efforts to combat illegal gunrunning from the U.S. to Mexico stumbles                                                   ,TNWSS
Two of five suspects in Brooklyn playground rape turned themselves in:                                                                        ,TNWSS
Oscar Pistorius files papers to appeal his murder conviction: family spokesperson                                                             ,TNWSS
Teenager says attack on Jewish teacher was for Islamic State: prosecutor                                                                      ,TNWSS
“David Bowie” collection of Twitter reactions:  “                                                                                             ,TNWSS
" U.S., Mexican efforts to battle gun trafficking falter - GAO "                                                                              ,TNWSS
Mexico starts extradition process for drug lord 'El Chapo' Guzman:                                                                            ,TNWSS
Turkey unsettled by 'anti-Islamic' messages in U.S. presidency race: minister                                                                 ,TNWSS
