Myanmar army chief to get five year extension as talks with Suu Kyi continue-media                                                            ,TNWSS
U.S. OKs sale of 8 Lockheed F-16 fighter jets to Pakistan - Pentagon                                                                          ,TNWSS
China foreign minister urges U.S. caution on missile system                                                                                   ,TNWSS
"'No Bashar al-Assad in the future', says Saudi foreign minister: report  "                                                                   ,TNWSS
Russia keeps bombing despite Syria truce; Assad vows to fight on                                                                              ,TNWSS
Cameron defends Britain's desire for sovereignty before EU summit                                                                             ,TNWSS
Germany's Merkel says getting confident about UK deal with EU                                                                                 ,TNWSS
Our top photos of the week from around the world:                                                                                             ,TNWSS
Candidates promise peace ahead of Central African elections                                                                                   ,TNWSS
U.S. okays sale of eight Lockheed F-16 fighter jets to Pakistan: Pentagon                                                                     ,TNWSS
First encounter in history between Roman Catholic pope and Russian Orthodox patriarch:                                                        ,TNWSS
Calls for more assistance for migrants and refugees:                                                                                          ,TNWSS
Pope Francis heads to Cuba for historic meeting. Twitter reacts:                                                                              ,TNWSS
"Iraq says moving troops, preparing offensive to retake Mosul "                                                                               ,TNWSS
"After short, tense meeting, Spain's Socialist head rejects backing Rajoy "                                                                   ,TNWSS
Pope arrives in Cuba to meet Russian Orthodox patriarch                                                                                       ,TNWSS
Israel says has mended fences with EU in Netanyahu-Mogherini call                                                                             ,TNWSS
Iran says ready to put rivalries aside with Saudi Arabia                                                                                      ,TNWSS
Spain's Socialist leader hopes for confidence vote at beginning of March                                                                      ,TNWSS
FIFA ethics committee bans Valcke for 12 years. Details -                                                                                     ,TNWSS
Thousands of Egyptian doctors protest over alleged police brutality                                                                           ,TNWSS
Why thousands of Iraqi refugees are leaving Finland voluntarily:                                                                              ,TNWSS
Interpol refuses Russian request for Khodorkovsky search notice: TASS                                                                         ,TNWSS
"NATO-Russia Council not yet possible, Stoltenberg says "                                                                                     ,TNWSS
"Quake hits eastern Indonesia island, communications down "                                                                                   ,TNWSS
South Sudan rebel leader wants soldiers out in further hurdle to peace deal                                                                   ,TNWSS
"China rules out joining anti-terrorism coalitions, says helping Iraq "                                                                       ,TNWSS
Student tortured and killed in Egypt given funeral at home in Italy                                                                           ,TNWSS
Three Iraqi presidential guards kidnapped near northern town: sources                                                                         ,TNWSS
Iraqi PM says has won back half of ISIS-held territories                                                                                      ,TNWSS
"If ribs visible, you were candidate for crematorium, Auschwitz survivor tells Nazi trial "                                                   ,TNWSS
Moscow court rejects lawsuit against Putin from Kremlin critic Navalny: RIA                                                                   ,TNWSS
This is why the WHO’s lead role in global health is at risk:                                                                                  ,TNWSS
Major powers agree to plan for 'cessation of hostilities' in Syria:                                                                           ,TNWSS
Colombia's ELN rebels declare 72-hour lockdown                                                                                                ,TNWSS
FIFA ethics committee bans former secretary general Valcke                                                                                    ,TNWSS
WHO sees Zika link proven in weeks as U.S. and India lead vaccine race -                                                                      ,TNWSS
Thousands of Iraqi refugees leave Finland voluntarily:                                                                                        ,TNWSS
Bolivia's Morales loses ground ahead of Feb. 21 referendum: poll                                                                              ,TNWSS
"Srebrenica general died of natural causes, war crimes court says "                                                                           ,TNWSS
"Building collapses in central Istanbul, unclear if casualties: media "                                                                       ,TNWSS
Kenya's Ruto hopes for Hague victory due to lost witness testimony                                                                            ,TNWSS
India's top court says Gandhis need to face trial in graft case                                                                               ,TNWSS
"In Myanmar, political mood sours as transition talks hit a snag "                                                                            ,TNWSS
"Millennium after split, pope and Russian church to meet in Cuba "                                                                            ,TNWSS
Turkish military says killed 27 Kurdish militants in southeast                                                                                ,TNWSS
Turning over new leaf: Ousted Thai PM picks lettuce for the cameras                                                                           ,TNWSS
Rwanda to send Burundi refugees to other countries after U.S. warning                                                                         ,TNWSS
Greek police fire tear gas at angry farmers rallying in Athens                                                                                ,TNWSS
Philippines considers two-way sea talks with China - if wins case at The Hague                                                                ,TNWSS
Italy's Renzi rejects Church interference in gay civil unions debate                                                                          ,TNWSS
Britain says missing Hong Kong bookseller 'involuntarily removed' to China:                                                                   ,TNWSS
"Suspected Islamist militants attack Mali U.N. base, several dead "                                                                           ,TNWSS
India's top court calls for improved compensation for rape victims                                                                            ,TNWSS
Yellen's dilemma: A downturn with no easy response                                                                                            ,TNWSS
"South Korea, U.S. to discuss missile defense; South cuts power to Kaesong park  "                                                            ,TNWSS
Pakistan arrests 97 al-Qaeda and other militants; foils planned jailbreak                                                                     ,TNWSS
"With prize in sight, Brexit camp risks dashing its dream "                                                                                   ,TNWSS
Oregon occupiers warn authorities of booby traps at refuge                                                                                    ,TNWSS
Australian Cabinet minister resigns over unofficial China trip                                                                                ,TNWSS
Woman whose family inspired Oregon standoff hopes more challenge govt                                                                         ,TNWSS
"Crude prices jump 5 pct, but oversupply still damps outlook  "                                                                               ,TNWSS
"Venezuela top court grants Maduro economic emergency powers, opposition cries foul "                                                         ,TNWSS
Beijing offers support for Hong Kong after New Year violence                                                                                  ,TNWSS
State Dept. subpoenaed documents from Clinton Foundation: report                                                                              ,TNWSS
"South Korea cuts off power, water into Kaesong zone in North Korea  "                                                                        ,TNWSS
"In Myanmar, slum eviction highlights Suu Kyi's military challenge "                                                                          ,TNWSS
Major powers agree on plan to break Syria deadlock                                                                                            ,TNWSS
"Final communique on Syria has been agreed, Western diplomatic source says"                                                                   ,TNWSS
Taiwan city looks at developer's other buildings after quake collapse                                                                         ,TNWSS
"Citing Reuters story, Russian anti-corruption campaigner Navalny files lawsuit against Putin  "                                              ,TNWSS
No plans at this time for joint U.S.-India navy patrols: State Dept.                                                                          ,TNWSS
U.S. says has no reason to doubt North Korea army chief executed                                                                              ,TNWSS
"Iran's main opposition leaderless, but insists it's not a spent force "                                                                      ,TNWSS
"Saudi warns U.N., aid workers to leave rebel-held areas in Yemen "                                                                           ,TNWSS
"Brother of ex-Chinese official sharing golf secrets in U.S., not state secrets - attorney "                                                  ,TNWSS
South Sudan president Kiir appoints rival Machar as vice president                                                                            ,TNWSS
"Obama, Netanyahu may agree defense deal in Washington next month, envoy says "                                                               ,TNWSS
Russia boosts ties with Iraq in challenge to U.S. influence                                                                                   ,TNWSS
South Africa to procure nuclear energy at affordable scale: Zuma                                                                              ,TNWSS
Russia raises specter of permanent or 'world war' if Syria talks fail                                                                         ,TNWSS
"Central Europeans need to do more to help refugees, U.N. agency says "                                                                       ,TNWSS
Myanmar's outgoing president cancels visit to U.S.-ASEAN summit next week                                                                     ,TNWSS
Former Pakistan military leader Musharraf hospitalized with chest pain                                                                        ,TNWSS
Cypriot president says peace talks make progress but work needed                                                                              ,TNWSS
" Einstein was right, again: gravitational waves detected.  "                                                                                 ,TNWSS
U.N. mission sends Burundi officers home over unrest                                                                                          ,TNWSS
"Biden, Poroshenko discuss need for reforms in Ukraine: White House "                                                                         ,TNWSS
U.S. has 'significantly' upped strikes on Islamic State in Afghanistan: general                                                               ,TNWSS
Who’s paying for the WHO – and for how long?                                                                                                  ,TNWSS
French PM Valls says new government to keep up reforms                                                                                        ,TNWSS
Romanian PM dismisses tax chiefs over EU funds fraud inquiry                                                                                  ,TNWSS
LIGO finds gravitational waves - and here's how Twitter reacted.                                                                              ,TNWSS
Kremlin critic Navalny files lawsuit against Putin                                                                                            ,TNWSS
Iraqi PM discourages Kurdish independence referendum                                                                                          ,TNWSS
France's Hollande reshuffles his government before 2017 elections                                                                             ,TNWSS
Kerry wants 'all or nothing' truce at Syria talks                                                                                             ,TNWSS
NATO allies launch sea mission against people-smugglers:                                                                                      ,TNWSS
U.N. rights expert accuses Israel of excessive force against Palestinians                                                                     ,TNWSS
North Korea says South's pulling out of industrial zone is a 'declaration of war':                                                            ,TNWSS
Ripple effect: scientists await word on gravitational waves -                                                                                 ,TNWSS
EU leaders left to iron out remaining issues in Britain talks next week                                                                       ,TNWSS
French left-winger to run for presidency in setback for Hollande:                                                                             ,TNWSS
"U.S. planes bombed Aleppo, not ours: Russia -  "                                                                                             ,TNWSS
Greeks at frontline of migrant crisis angry at Europe's criticism                                                                             ,TNWSS
"Attacker shoots at offices in Saudi Arabia, six dead "                                                                                       ,TNWSS
Gun attack on Education Department in Saudi Arabia killed six employees                                                                       ,TNWSS
South's move out of industrial zone seen as 'declaration of war' by North Korea:                                                              ,TNWSS
U.S. tells allies campaign to defeat Islamic State must be accelerated                                                                        ,TNWSS
Prison riot in northeast Mexico kills dozens: local media                                                                                     ,TNWSS
"Auschwitz guard, 94, goes on trial in Germany:  "                                                                                            ,TNWSS
Pro-government forces seize camp outside Yemen capital                                                                                        ,TNWSS
Turkish security operations against militants in southeast town complete: interior minister                                                   ,TNWSS
Turkey's Erdogan warns patience will run out on Syria:                                                                                        ,TNWSS
"Turkey-Israel talks to restore ties going well, no deal yet: AKP spokesman "                                                                 ,TNWSS
"Yen, bonds, gold all gain at dollar's expense, stocks slump:  "                                                                              ,TNWSS
Iran's Rouhani calls for political unity before crucial votes: TV                                                                             ,TNWSS
"EU warns UK deal 'fragile' as Paris, East seek changes:"                                                                                     ,TNWSS
"China warns on South China Sea as U.S., India consider patrols "                                                                             ,TNWSS
"Auschwitz guard, 94, stands trial in Germany "                                                                                               ,TNWSS
"Any NATO refugee mission would go after smugglers, U.S.'s Carter says "                                                                      ,TNWSS
Suspected Islamist militants kill three at Mali customs post                                                                                  ,TNWSS
Nigeria faces new rift over alleged Shi'ite massacre                                                                                          ,TNWSS
Indian soldier found alive after six days buried under avalanche dies                                                                         ,TNWSS
"Australia directed officials how to address Nauru rights concerns, documents show  "                                                         ,TNWSS
French left-winger Melenchon to run for presidency in upset for Hollande                                                                      ,TNWSS
Netherlands to form 300-strong border guard for international missions                                                                        ,TNWSS
"Russia says U.S. planes bombed Syria's Aleppo on Wednesday, not Russian ones: TASS  "                                                        ,TNWSS
Flint has highest rate of vacant homes in United States: report                                                                               ,TNWSS
Dozens face riot charges over Hong Kong Lunar New Year violence                                                                               ,TNWSS
"Greek navy helicopter crashes in Aegean, killing three "                                                                                     ,TNWSS
FBI tightens grip on final occupiers at Oregon wildlife refuge                                                                                ,TNWSS
Thailand's 'sea gypsies' fight for access to ancestral shrines                                                                                ,TNWSS
Syrian Kurdish forces said to capture most of rebel-held former military airport                                                              ,TNWSS
Australian looks set for climate skeptic deputy PM                                                                                            ,TNWSS
North Korea feels global pressure but not completely ostracized                                                                               ,TNWSS
"Short of options, Sri Lanka turns back to Beijing's embrace  "                                                                               ,TNWSS
FBI moving in on last four occupiers at Oregon wildlife refuge                                                                                ,TNWSS
"North Korea satellite not transmitting, but rocket payload a concern: U.S.  "                                                                ,TNWSS
"Ex-president of El Salvador faces trial over source of $700,000 "                                                                            ,TNWSS
"Turkey, Greece seek NATO mission in Aegean: German official "                                                                                ,TNWSS
"With fewer U.S. troops in Afghanistan, pressure grows for more air strikes "                                                                 ,TNWSS
Senate votes overwhelmingly for tougher North Korea sanctions                                                                                 ,TNWSS
Consternation at Austrian case of Nazi camp survivors called 'a plague'                                                                       ,TNWSS
U.N. Security Council members push Russia to stop Aleppo bombing                                                                              ,TNWSS
Russia proposes March 1 ceasefire in Syria: Western official                                                                                  ,TNWSS
Female suicide bombers kill over 60 people in northeast Nigeria: officials.                                                                   ,TNWSS
Syrian rebels demand U.S. action ahead of peace talks:                                                                                        ,TNWSS
Damascus expects tough but short battle for Aleppo                                                                                            ,TNWSS
Poland to join fight versus Islamic State in return for NATO help in east                                                                     ,TNWSS
Norway is soul-searching over killer Breivik's lawsuit.                                                                                       ,TNWSS
U.S. says raised concerns with Rwanda over its activities in Burundi                                                                          ,TNWSS
Prosecutor recommends life in prison for former Chad ruler                                                                                    ,TNWSS
More than 60 people killed in suicide bombs in Nigeria: officials                                                                             ,TNWSS
U.S. and India are considering joint patrols in South China Sea - U.S. official.                                                              ,TNWSS
EU-UK deal 'very fragile' but Tusk hopeful for summit                                                                                         ,TNWSS
"North Korea has executed its army chief of staff, according to South Korean media reports.  "                                                ,TNWSS
Stalin-era prison chief jailed for 20 years in Romania:                                                                                       ,TNWSS
Latest poll indicates growing support for British EU exit                                                                                     ,TNWSS
Colombian rebels promise end to use of child soldiers                                                                                         ,TNWSS
Putin may benefit from meeting of pope and patriarch                                                                                          ,TNWSS
U.S. envoy says Islamic State branch in Libya greatest cause for concern                                                                      ,TNWSS
Saudi King Salman to visit Moscow in mid-March: RIA cites Kremlin aide                                                                        ,TNWSS
"Follow the gun, save the elephant:  "                                                                                                        ,TNWSS
"France's Fabius leaves office, wider reshuffle due:  "                                                                                       ,TNWSS
"In Yemen war, hospitals bombed to rubble, starvation spreads "                                                                               ,TNWSS
"Greek PM offers talks on pension reform, rebuffed by farmers:  "                                                                             ,TNWSS
Erdogan chastises U.S. over support for Syrian Kurds:                                                                                         ,TNWSS
Wounded Syrian rebels say Russia crippling their insurgency                                                                                   ,TNWSS
German train crash investigations focus on signal controller: source                                                                          ,TNWSS
Probe into German train crash is focusing on human error by signals controller - source involved in investigation.                            ,TNWSS
NATO to agree new Russian deterrent but avoid Cold War footing                                                                                ,TNWSS
North Korea executes army chief of staff - South Korean media:                                                                                ,TNWSS
