"No thanks, I'm good."                                                                                                                        ,TWSS
My mother's coming.                                                                                                                           ,TWSS
"Wow, that is really hard."                                                                                                                   ,TWSS
You really think you can go all day long?                                                                                                     ,TWSS
"Well, you always left me satisfied and smiling..."                                                                                           ,TWSS
Why did you get it so big?                                                                                                                    ,TWSS
Does the skin look red and swollen?                                                                                                           ,TWSS
You should put butter on it.                                                                                                                  ,TWSS
You already did me.                                                                                                                           ,TWSS
Put this matter to bed.                                                                                                                       ,TWSS
I can't stay on top of you 24/7.                                                                                                              ,TWSS
They taste so good in my mouth.                                                                                                               ,TWSS
I want you to think about it long and hard.                                                                                                   ,TWSS
Let's just blow this party off.                                                                                                               ,TWSS
Why is this so hard?                                                                                                                          ,TWSS
I need two men on this.                                                                                                                       ,TWSS
Dip it in the water so it'll slide down your gullet more easily                                                                               ,TWSS
Can you make that straighter?                                                                                                                 ,TWSS
I say things like that to lighten the tension when things sort of get hard.                                                                   ,TWSS
Come again?                                                                                                                                   ,TWSS
And you were directly under her the entire time?                                                                                              ,TWSS
"Well, you are hardly my first!"                                                                                                              ,TWSS
Force it in as deep as you can.                                                                                                               ,TWSS
It was easy to get in but impossible to rise up.                                                                                              ,TWSS
Hold it in your mouth if you can't swallow.                                                                                                   ,TWSS
It's gonna be tight.                                                                                                                          ,TWSS
It squeaks when you bang it.                                                                                                                  ,TWSS
Don't make it harder than it needs to be.                                                                                                     ,TWSS
"Dwight, get out of my nook!"                                                                                                                 ,TWSS
"Oscar, would you reach over and touch his thing?"                                                                                            ,TWSS
This is huge.                                                                                                                                 ,TWSS
"I can't force you to go down, but I can entice you."                                                                                         ,TWSS
Instead you screwed me.                                                                                                                       ,TWSS
Put it away.                                                                                                                                  ,TWSS
You need to get back on top.                                                                                                                  ,TWSS
Get it up.                                                                                                                                    ,TWSS
The trick is to do it face down with the post in your mouth.                                                                                  ,TWSS
"Michael, you're making this harder than it has to be."                                                                                       ,TWSS
"Oscar is my queen. That's easy, gimme a hard one."                                                                                           ,TWSS
Comedy is a place where the mind goes to tickle itself.                                                                                       ,TWSS
"I'm not saying it won't be hard, but we can make it work."                                                                                   ,TWSS
This is going to feel so good getting this thing off my chest.                                                                                ,TWSS
There's no way you guys are making this magic with just your mouths.                                                                          ,TWSS
"Michael, I can't believe you came."                                                                                                          ,TWSS
Five dollars if it’s dry. Twenty dollars if it’s wet.                                                                                         ,TWSS
"Pull out, you are not doing any good there"                                                                                                  ,TWSS
it's better where it's wetter                                                                                                                 ,TWSS
you ready to get wet?                                                                                                                         ,TWSS
I am going to pull out                                                                                                                        ,TWSS
you want me to eat that                                                                                                                       ,TWSS
hold this over your mouth                                                                                                                     ,TWSS
anyone else coming                                                                                                                            ,TWSS
you want to touch it                                                                                                                          ,TWSS
"pen is broken, please use fingers"                                                                                                           ,TWSS
"Almost there, a few seconds more"                                                                                                            ,TWSS
insert here                                                                                                                                   ,TWSS
Norway denies inhuman treatment of mass killer Breivik:                                                                                       ,TNWSS
"U.S. says working with Russia on aid flow, truce in Syria "                                                                                  ,TNWSS
Warfare among French socialists hurts Hollande's re-election bid                                                                              ,TNWSS
Convicted ex-CEO of OAS may name Lula in Brazil plea deal: newspaper                                                                          ,TNWSS
Russia says 40 agreements signed on ceasefire in Syria: agencies                                                                              ,TNWSS
"Mozambique plane debris believed to be from Boeing 777, says Malaysia minister:  "                                                           ,TNWSS
White House says Biden to visit Middle East March 5-10                                                                                        ,TNWSS
Mexican drug lord Guzman seeks to speed up extradition to U.S.                                                                                ,TNWSS
Military invites experts to 'Hack the Pentagon':                                                                                              ,TNWSS
"Passion spent, Scots yet to be fired up by Britain's EU vote "                                                                               ,TNWSS
Mozambique plane debris believed to be from Boeing 777: Malaysia minister                                                                     ,TNWSS
"Austerity-hit Greeks help refugees with food, toys, time "                                                                                   ,TNWSS
"Russian, Belarussian fugitives arrested in Spanish resort for fraud: police "                                                                ,TNWSS
Turkish prime minister to visit Iran this week                                                                                                ,TNWSS
Al Qaeda leader bin Laden left $29 million inheritance for jihad                                                                              ,TNWSS
Meet the girls in Karachi changing the status quo. These boxers are aiming for international competitions.                                    ,TNWSS
Huge quake strikes off Indonesia but tsunami warnings cancelled:                                                                              ,TNWSS
Business ponders 'horrific' cost of end to borderless Europe                                                                                  ,TNWSS
London would lose out if UK votes 'out' - Hammond                                                                                             ,TNWSS
Public support for Hungarian PM's party drops in February: poll                                                                               ,TNWSS
Scott Kelly and Mikhail Kornienko - spacemen returned to Earth:                                                                               ,TNWSS
Facebook executive jailed in Brazil set to be released:                                                                                       ,TNWSS
"U.N. approves harsh new sanctions on North Korea drafted by U.S., China "                                                                    ,TNWSS
British military rapped over deaths of three soldiers on exercise                                                                             ,TNWSS
Gloom deepens over Ukraine peace deal before Paris meeting                                                                                    ,TNWSS
Italy may recall student murder probe team from Egypt over lack of cooperation: judicial source                                               ,TNWSS
18 killed in car bomb against Syrian insurgents in southern province Quneitra: monitor                                                        ,TNWSS
Netanyahu seeks to expel families of Palestinian attackers:                                                                                   ,TNWSS
Possible debris from Malaysia flight MH370 found near Mozambique: NBC                                                                         ,TNWSS
U.S. plans naval exercises with India and Japan in Philippine Sea                                                                             ,TNWSS
South Korea demands more sanctions on 'serial offender' North:                                                                                ,TNWSS
Germany takes on Facebook in first-ever competition probe -                                                                                   ,TNWSS
"Germany calls on EU to help Greece, urges Athens to protect border:  "                                                                       ,TNWSS
Palestinians turn to makeshift guns in escalation of street violence                                                                          ,TNWSS
Russian prosecutor demands 23 years in jail for female Ukrainian pilot                                                                        ,TNWSS
Osama bin Laden wrote a letter calling on the US to fight catastrophic climate change:                                                        ,TNWSS
Indian student held on sedition charge bailed after free-speech protests                                                                      ,TNWSS
Briton guilty of raping women he met via                                                                                                      ,TNWSS
UPDATE: Tsunami warning lifted following major earthquake off Indonesia 's Sumatra island TVRI says quoting meteorolgical agency official     ,TNWSS
EU launches emergency refugee aid scheme for Greece:                                                                                          ,TNWSS
Pakistani man kills sisters in suspected honor killing                                                                                        ,TNWSS
Spanish parties dismiss Socialists' 'unreal' bid to govern:                                                                                   ,TNWSS
"In Islamic State battle, Cairo struggles to rally Sinai tribes "                                                                             ,TNWSS
UPDATE: Major 7.9 magnitude quake strikes southwest of Indonesia - USGS -                                                                     ,TNWSS
Major 7.9 magnitude quake strikes southwest of Indonesia: USGS.                                                                               ,TNWSS
UPDATE: Indonesia issues tsunami warning after big Sumatra quake                                                                              ,TNWSS
Irish PM says open to talks with main rival                                                                                                   ,TNWSS
Major 8.1 magnitude quake strikes southwest of Indonesia: USGS                                                                                ,TNWSS
"UPDATE: Indonesia National Meterological agency -  issues early tsunami warning in West Sumatra, North Sumatra, Aceh "                       ,TNWSS
Moody's cuts China outlook to negative:                                                                                                       ,TNWSS
"U.S. targets Islamic State with 21 strikes in Iraq, Syria: statement "                                                                       ,TNWSS
Major 8.2 magnitude quake strikes southwest of Indonesia: USGS.                                                                               ,TNWSS
German court throws out objections by far-right NPD in ban case                                                                               ,TNWSS
"Platini appeals FIFA ban, tribunal says:  "                                                                                                  ,TNWSS
Irish PM seeks to form new government:                                                                                                        ,TNWSS
"Anti-immigrant 'Soldiers of Odin' expand from Finland to Nordics, Baltics:  "                                                                ,TNWSS
North Korea says nuclear deterrent not aimed at South                                                                                         ,TNWSS
South Africa's finance minister Gordhan says unable to meet deadline to answer police questions                                               ,TNWSS
Record-breaking South Korea filibuster over 'terror' law ends on ninth day                                                                    ,TNWSS
Airports say Schengen collapse would force costly terminal redesigns                                                                          ,TNWSS
43 Kurdish YPG fighters killed in Syria in battle with Islamic State                                                                          ,TNWSS
Taliban claim blast that killed two Pakistani staff of U.S. consulate                                                                         ,TNWSS
A year in space: Scott Kelly and Mikhail Kornienko return to Earth -                                                                          ,TNWSS
South Korea minister calls for tough sanctions on North                                                                                       ,TNWSS
Turkey says offers to sign migrant readmission agreements with 14 countries                                                                   ,TNWSS
Pope says Church does not want 'dirty money'                                                                                                  ,TNWSS
Syrian govt forces open new battle with rebels in northwest                                                                                   ,TNWSS
Turkey says has hit only Islamic State targets since ceasefire started                                                                        ,TNWSS
Syrian opposition says peace talks date remains 'hypothetical': Arabiya al-Hadath TV                                                          ,TNWSS
Bin Laden called for Americans to rise up over climate change:                                                                                ,TNWSS
"Release of jailed Turkish journalists is 'defeat' for Erdogan, Dundar says "                                                                 ,TNWSS
Global stocks rally as global slowdown fears fade:                                                                                            ,TNWSS
Gulf Arab states designate Hezbollah a terrorist organization: statement                                                                      ,TNWSS
Spain's Rajoy dismisses Socialists' 'unreal' bid to govern                                                                                    ,TNWSS
Australia softens sanctions against Iran                                                                                                      ,TNWSS
U.S. forces capture Islamic State operative in Iraq: NYT                                                                                      ,TNWSS
Asia stocks rise as risk appetite returns; data boost:                                                                                        ,TNWSS
New coalition commander inherits raging war in Afghanistan                                                                                    ,TNWSS
Jordanian forces kill 7 Islamist militants in Irbid: security source                                                                          ,TNWSS
Uzbek woman says in court 'Allah ordered' her to sever child's head                                                                           ,TNWSS
"Explosions, gunfire heard near Indian consulate in Afghan city "                                                                             ,TNWSS
One Chinese worker killed in Laos 'militant' attack: Xinhua                                                                                   ,TNWSS
Texas abortion case goes before shorthanded U.S. Supreme Court                                                                                ,TNWSS
Two Palestinian teens shot dead after attacking Israeli in West Bank                                                                          ,TNWSS
Thai junta's intimidation of academics reveals insecurity: rights group                                                                       ,TNWSS
U.S. turns to Broadway to promote gay rights at United Nations                                                                                ,TNWSS
Hunger soars in CAR as nearly 2.5 million face food shortages                                                                                 ,TNWSS
Most nations in Americas have laws that can suppress journalism: report                                                                       ,TNWSS
Haiti interim president: Election body to decide if vote deadline viable                                                                      ,TNWSS
Five murdered youth in Mexico confused for cartel members                                                                                     ,TNWSS
"Jamaican opposition wins one seat margin, new PM seen this week  "                                                                           ,TNWSS
Catholic Church abuse victims call for meeting with Pope                                                                                      ,TNWSS
Filipino fishermen say China blocking access to South China Sea atoll: media                                                                  ,TNWSS
"Many indigenous people lack title to land where they live, research shows "                                                                  ,TNWSS
"Stuck in limbo, Mauritania's Syrian refugees dream of the West "                                                                             ,TNWSS
Chongqing blazes economic trail as Bo scandal recedes                                                                                         ,TNWSS
Top Vatican cardinal says never raised abuse concerns with superiors                                                                          ,TNWSS
China's militarization of South China Sea will have consequences: U.S.                                                                        ,TNWSS
Newly released bin Laden letter calls on Americans to help Obama fight climate change:                                                        ,TNWSS
"Hezbollah criticizes Saudi Arabia, sees new chapter of struggle in Lebanon "                                                                 ,TNWSS
Metallurgical company CEO arrested for exports to Iran: U.S. Justice Department                                                               ,TNWSS
Jordanian security clash with suspected Islamist militants in Irbid                                                                           ,TNWSS
Turkey's Erdogan offers to help West Africa fight terrorism                                                                                   ,TNWSS
Irish PM says will attempt to form new government                                                                                             ,TNWSS
Guatemala sex slave victims seek $3 million in damages in historic wartime rape trial                                                         ,TNWSS
Prominent Saudi cleric on Islamic State hit list is injured in Philippines shooting:                                                          ,TNWSS
Rival of Uganda's Museveni challenges presidential poll result                                                                                ,TNWSS
"Living in filth, Greece's migrants battle hunger and cold:  "                                                                                ,TNWSS
Now or never: Trump's 'wall' talk sparks migrant rush on U.S.-Mexico border:                                                                  ,TNWSS
"Another blast at Severstal's mine in Arctic, no one hurt: reports "                                                                          ,TNWSS
Executives of Brazil's No. 2 building company say it paid Rousseff campaign suppliers: paper                                                  ,TNWSS
U.N. will restart Syria peace talks on March 9. More here:                                                                                    ,TNWSS
"Billionaire Mikhelson is now Russia's richest man, says Forbes:  "                                                                           ,TNWSS
U.N. delays vote on tough new North Korea sanctions at Russia's request:                                                                      ,TNWSS
China is to lay off five to six million workers. Find out more:                                                                               ,TNWSS
Tent city on Greek border grows as migrant stalemate persists                                                                                 ,TNWSS
EU to call for emergency humanitarian aid to Greece:                                                                                          ,TNWSS
